{
  "schemaVersion": "2.0.0",
  "generatedAt": "2026-07-11T00:00:00Z",
  "companies": [
    {
      "id": "MFC",
      "name": "Manuvie",
      "fullName": "La Société Financière Manuvie",
      "ticker": "MFC.TO",
      "investorRelationsUrl": "https://www.manulife.com/ca/en/about-us/investors/results-and-reports"
    },
    {
      "id": "SLF",
      "name": "Sun Life",
      "fullName": "Sun Life Financial Inc.",
      "ticker": "SLF.TO",
      "investorRelationsUrl": "https://www.sunlife.com/en/investors/financial-results-and-reports/quarterly-reports/"
    },
    {
      "id": "GWO",
      "name": "Great-West Lifeco",
      "fullName": "Great-West Lifeco Inc.",
      "ticker": "GWO.TO",
      "investorRelationsUrl": "https://www.greatwestlifeco.com/en/investor-relations.html"
    },
    {
      "id": "IAG",
      "name": "iA Groupe financier",
      "fullName": "iA Société financière inc.",
      "ticker": "IAG.TO",
      "investorRelationsUrl": "https://ia.ca/a-propos/investisseurs/rapports-financiers"
    }
  ],
  "periods": [
    {
      "key": "T1",
      "type": "quarter",
      "year": 2025,
      "quarter": 1,
      "endDate": "2025-03-31",
      "label": "T1 2025"
    },
    {
      "key": "T2",
      "type": "quarter",
      "year": 2025,
      "quarter": 2,
      "endDate": "2025-06-30",
      "label": "T2 2025"
    },
    {
      "key": "T3",
      "type": "quarter",
      "year": 2025,
      "quarter": 3,
      "endDate": "2025-09-30",
      "label": "T3 2025"
    },
    {
      "key": "AN",
      "type": "annual",
      "year": 2025,
      "quarter": null,
      "endDate": "2025-12-31",
      "label": "Annuel 2025"
    }
  ],
  "observations": [
    {
      "id": "MFC-2025-T1-core_eps",
      "companyId": "MFC",
      "period": {
        "key": "T1",
        "type": "quarter",
        "year": 2025,
        "quarter": 1,
        "endDate": "2025-03-31",
        "label": "T1 2025"
      },
      "metricId": "core_eps",
      "label": "BPA activités de base",
      "value": 0.99,
      "unit": "CAD_PER_SHARE",
      "displayValue": "0,99 $",
      "comparison": {
        "value": 0.96,
        "displayValue": "0,96 $ (T1 2024)",
        "periodLabel": "T1 2024",
        "change": 0.03125000000000003,
        "changeUnit": "PERCENT",
        "displayChange": "+3 %"
      },
      "direction": "up",
      "note": "RPA tiré des activités de base, taux de change constant",
      "source": {
        "sourceId": "mfc-results",
        "url": "https://www.manulife.com/ca/en/about-us/investors/results-and-reports",
        "title": "Manuvie — T1 2025 (31 mars 2025)",
        "publishedAt": "2025-05-07",
        "fetchedAt": "2026-07-11T00:00:00Z",
        "documentHash": "sha256:ed9fcc6318f86b597327b92ceb40b98b8032caeb244ee3847f9f9a33c16d4adf",
        "priority": "primary"
      },
      "quality": {
        "status": "validated",
        "extractionMethod": "v1_migration",
        "confidence": 1,
        "warnings": [
          "Provenance migrée de la V1; empreinte calculée sur la référence de source."
        ]
      }
    },
    {
      "id": "MFC-2025-T1-net_income",
      "companyId": "MFC",
      "period": {
        "key": "T1",
        "type": "quarter",
        "year": 2025,
        "quarter": 1,
        "endDate": "2025-03-31",
        "label": "T1 2025"
      },
      "metricId": "net_income",
      "label": "Résultat net actionnaires",
      "value": 0.5,
      "unit": "CAD_BILLION",
      "displayValue": "0,5 G$",
      "comparison": {
        "value": 0.9,
        "displayValue": "0,9 G$ (T1 2024)",
        "periodLabel": "T1 2024",
        "change": -0.4444444444444445,
        "changeUnit": "PERCENT",
        "displayChange": "−48 %"
      },
      "direction": "down",
      "note": "Bénéfice net IFRS attribué aux actionnaires",
      "source": {
        "sourceId": "mfc-results",
        "url": "https://www.manulife.com/ca/en/about-us/investors/results-and-reports",
        "title": "Manuvie — T1 2025 (31 mars 2025)",
        "publishedAt": "2025-05-07",
        "fetchedAt": "2026-07-11T00:00:00Z",
        "documentHash": "sha256:ed9fcc6318f86b597327b92ceb40b98b8032caeb244ee3847f9f9a33c16d4adf",
        "priority": "primary"
      },
      "quality": {
        "status": "validated",
        "extractionMethod": "v1_migration",
        "confidence": 1,
        "warnings": [
          "Provenance migrée de la V1; empreinte calculée sur la référence de source."
        ]
      }
    },
    {
      "id": "MFC-2025-T1-licat_ratio",
      "companyId": "MFC",
      "period": {
        "key": "T1",
        "type": "quarter",
        "year": 2025,
        "quarter": 1,
        "endDate": "2025-03-31",
        "label": "T1 2025"
      },
      "metricId": "licat_ratio",
      "label": "Ratio LICAT (MLI)",
      "value": 134,
      "unit": "PERCENT",
      "displayValue": "134 %",
      "comparison": {
        "value": 133,
        "displayValue": "∼133 % (T1 2024)",
        "periodLabel": "T1 2024",
        "change": 1,
        "changeUnit": "PERCENTAGE_POINT",
        "displayChange": "+1 pp"
      },
      "direction": "up",
      "note": "Ratio de la Manufacturers Life Insurance Co.",
      "source": {
        "sourceId": "mfc-results",
        "url": "https://www.manulife.com/ca/en/about-us/investors/results-and-reports",
        "title": "Manuvie — T1 2025 (31 mars 2025)",
        "publishedAt": "2025-05-07",
        "fetchedAt": "2026-07-11T00:00:00Z",
        "documentHash": "sha256:ed9fcc6318f86b597327b92ceb40b98b8032caeb244ee3847f9f9a33c16d4adf",
        "priority": "primary"
      },
      "quality": {
        "status": "validated",
        "extractionMethod": "v1_migration",
        "confidence": 1,
        "warnings": [
          "Provenance migrée de la V1; empreinte calculée sur la référence de source."
        ]
      }
    },
    {
      "id": "MFC-2025-T1-core_earnings",
      "companyId": "MFC",
      "period": {
        "key": "T1",
        "type": "quarter",
        "year": 2025,
        "quarter": 1,
        "endDate": "2025-03-31",
        "label": "T1 2025"
      },
      "metricId": "core_earnings",
      "label": "Résultat activités de base",
      "value": 1.8,
      "unit": "CAD_BILLION",
      "displayValue": "1,8 G$",
      "comparison": {
        "value": 1.8,
        "displayValue": "1,8 G$ (T1 2024)",
        "periodLabel": "T1 2024",
        "change": 0,
        "changeUnit": "PERCENT",
        "displayChange": "−1 %"
      },
      "direction": "down",
      "note": "Résultat tiré des activités de base (taux change constant)",
      "source": {
        "sourceId": "mfc-results",
        "url": "https://www.manulife.com/ca/en/about-us/investors/results-and-reports",
        "title": "Manuvie — T1 2025 (31 mars 2025)",
        "publishedAt": "2025-05-07",
        "fetchedAt": "2026-07-11T00:00:00Z",
        "documentHash": "sha256:ed9fcc6318f86b597327b92ceb40b98b8032caeb244ee3847f9f9a33c16d4adf",
        "priority": "primary"
      },
      "quality": {
        "status": "validated",
        "extractionMethod": "v1_migration",
        "confidence": 1,
        "warnings": [
          "Provenance migrée de la V1; empreinte calculée sur la référence de source."
        ]
      }
    },
    {
      "id": "MFC-2025-T2-core_eps",
      "companyId": "MFC",
      "period": {
        "key": "T2",
        "type": "quarter",
        "year": 2025,
        "quarter": 2,
        "endDate": "2025-06-30",
        "label": "T2 2025"
      },
      "metricId": "core_eps",
      "label": "BPA activités de base",
      "value": 0.95,
      "unit": "CAD_PER_SHARE",
      "displayValue": "0,95 $",
      "comparison": {
        "value": 0.93,
        "displayValue": "0,93 $ (T2 2024)",
        "periodLabel": "T2 2024",
        "change": 0.02150537634408592,
        "changeUnit": "PERCENT",
        "displayChange": "+2 %"
      },
      "direction": "up",
      "note": "RPA tiré des activités de base, taux de change constant",
      "source": {
        "sourceId": "mfc-results",
        "url": "https://www.manulife.com/ca/en/about-us/investors/results-and-reports",
        "title": "Manuvie — T2 2025 (30 juin 2025)",
        "publishedAt": "2025-08-06",
        "fetchedAt": "2026-07-11T00:00:00Z",
        "documentHash": "sha256:f1a3bde03bc03045efe47a70b29152357f7f7344083403d7364640ef33622c0f",
        "priority": "primary"
      },
      "quality": {
        "status": "validated",
        "extractionMethod": "v1_migration",
        "confidence": 1,
        "warnings": [
          "Provenance migrée de la V1; empreinte calculée sur la référence de source."
        ]
      }
    },
    {
      "id": "MFC-2025-T2-net_income",
      "companyId": "MFC",
      "period": {
        "key": "T2",
        "type": "quarter",
        "year": 2025,
        "quarter": 2,
        "endDate": "2025-06-30",
        "label": "T2 2025"
      },
      "metricId": "net_income",
      "label": "Résultat net actionnaires",
      "value": 1.8,
      "unit": "CAD_BILLION",
      "displayValue": "1,8 G$",
      "comparison": {
        "value": 1.1,
        "displayValue": "1,1 G$ (T2 2024)",
        "periodLabel": "T2 2024",
        "change": 0.6363636363636362,
        "changeUnit": "PERCENT",
        "displayChange": "+88 %"
      },
      "direction": "up",
      "note": "Bénéfice net IFRS attribué aux actionnaires",
      "source": {
        "sourceId": "mfc-results",
        "url": "https://www.manulife.com/ca/en/about-us/investors/results-and-reports",
        "title": "Manuvie — T2 2025 (30 juin 2025)",
        "publishedAt": "2025-08-06",
        "fetchedAt": "2026-07-11T00:00:00Z",
        "documentHash": "sha256:f1a3bde03bc03045efe47a70b29152357f7f7344083403d7364640ef33622c0f",
        "priority": "primary"
      },
      "quality": {
        "status": "validated",
        "extractionMethod": "v1_migration",
        "confidence": 1,
        "warnings": [